{
  "providers": {
    "cli-proxy-api": {
      "api_base": "http://cli-proxy-api:8317",
      "models_autofill_disabled": true,
      "access_groups": ["General"],
      "interfaces": {
        "anthropic": {
          "models": {
            "a-fallback": {}, "a-fallback-vision": {},
            "a-0": {}, "a-0-vision": {},
            "a-1": {}, "a-1-vision": {},
            "a-2": {}, "a-2-vision": {},
            "a-3": {}, "a-3-vision": {}
          }
        },
        "openai": {
          "models": {
            "o-fallback": {}, "o-fallback-vision": {},
            "o-0": {}, "o-0-vision": {},
            "o-1": {}, "o-1-vision": {},
            "o-2": {}, "o-2-vision": {},
            "o-3": {}, "o-3-vision": {},
            "codex-auto-review": {},
            "gpt-image-2.5-flare": {}, "gpt-image-2.5-sunburst": {}
          }
        }
      }
    }
  },
  "public_model_hub": [],
  "model_name_base_model_map": {
    "a-fallback": "gpt-6.1-sol", "a-fallback-vision": "gpt-6.1-sol",
    "a-0": "gpt-6-astra", "a-0-vision": "gpt-6-astra",
    "a-1": "gpt-6.1-sol", "a-1-vision": "gpt-6.1-sol",
    "a-2": "gpt-6.1-sol", "a-2-vision": "gpt-6.1-sol",
    "a-3": "gpt-6-luna", "a-3-vision": "gpt-6-luna",
    "o-fallback": "gpt-6.1-sol", "o-fallback-vision": "gpt-6.1-sol",
    "o-0": "gpt-6-astra", "o-0-vision": "gpt-6-astra",
    "o-1": "gpt-6.1-sol", "o-1-vision": "gpt-6.1-sol",
    "o-2": "gpt-6.1-sol", "o-2-vision": "gpt-6.1-sol",
    "o-3": "gpt-6-luna", "o-3-vision": "gpt-6-luna"
  },
  "aliases": {
    "claude-*": "anthropic/a-1",
    "claude-fable-5-1": "anthropic/a-0",
    "claude-opus-5": "anthropic/a-1",
    "claude-sonnet-5": "anthropic/a-2",
    "claude-haiku-5-5": "anthropic/a-3",
    "openai/claude-*": "openai/o-1",
    "openai/claude-fable-5-1": "openai/o-0",
    "openai/claude-opus-5": "openai/o-1",
    "openai/claude-sonnet-5": "openai/o-2",
    "openai/claude-haiku-5-5": "openai/o-3",
    "gpt-*": "openai/o-1",
    "gpt-6-astra": "openai/o-0",
    "gpt-6.1-sol": "openai/o-1",
    "gpt-6-luna": "openai/o-3",
    "anthropic/gpt-*": "anthropic/a-1",
    "anthropic/gpt-6-astra": "anthropic/a-0",
    "anthropic/gpt-6.1-sol": "anthropic/a-1",
    "anthropic/gpt-6-luna": "anthropic/a-3",
    "gpt-image-*": "openai/gpt-image-2.5-flare",
    "gpt-image-2.5-flare": "openai/gpt-image-2.5-flare",
    "gpt-image-2.5-sunburst": "openai/gpt-image-2.5-sunburst",
    "codex-auto-review": "openai/codex-auto-review"
  },
  "fallbacks": [
    {"anthropic/a-1,anthropic/a-2,anthropic/a-3": ["anthropic/a-fallback"]},
    {"anthropic/a-1-vision,anthropic/a-2-vision,anthropic/a-3-vision": ["anthropic/a-fallback-vision"]},
    {"openai/o-1,openai/o-2,openai/o-3": ["openai/o-fallback"]},
    {"openai/o-1-vision,openai/o-2-vision,openai/o-3-vision": ["openai/o-fallback-vision"]}
  ]
}
